{
  "schema_version": "1.0.0",
  "profile_id": "course-paper",
  "version": "1.0.0",
  "name": "course-paper",
  "enabled": true,
  "task_kind": "inquiry",
  "required_inputs": [
    "question",
    "course_requirements",
    "available_data"
  ],
  "attention_tags": [
    "method",
    "delivery"
  ],
  "output_fields": [
    "minimum_deliverable"
  ],
  "allowed_tool_categories": [
    "read_supplied"
  ],
  "voice": "persona",
  "recommendation_mode": "informational",
  "references": [],
  "source_trust": "built_in",
  "review_ref": "synthetic-protocol-tests"
}
