{
  "schema_version": "1.0.0",
  "profile_id": "event-plan",
  "version": "1.0.0",
  "name": "event-plan",
  "enabled": true,
  "task_kind": "decision",
  "required_inputs": [
    "plan",
    "budget",
    "roles"
  ],
  "attention_tags": [
    "risk",
    "operations"
  ],
  "output_fields": [
    "failure_paths"
  ],
  "allowed_tool_categories": [
    "read_supplied"
  ],
  "voice": "persona",
  "recommendation_mode": "conditional_advice",
  "references": [],
  "source_trust": "built_in",
  "review_ref": "synthetic-protocol-tests"
}
