{
  "schema_version": "1.0.0",
  "profile_id": "premortem",
  "version": "1.0.0",
  "name": "premortem",
  "enabled": true,
  "task_kind": "decision",
  "required_inputs": [
    "plan",
    "horizon",
    "success",
    "failure",
    "hard_constraints"
  ],
  "attention_tags": [
    "mechanism",
    "early-warning",
    "prevention"
  ],
  "output_fields": [
    "assumption",
    "event",
    "early_signal",
    "prevention",
    "response",
    "stop_condition"
  ],
  "allowed_tool_categories": [
    "read_supplied"
  ],
  "voice": "persona",
  "recommendation_mode": "conditional_advice",
  "references": [],
  "source_trust": "built_in",
  "review_ref": "synthetic-protocol-tests"
}
