{
  "schema_version": "1.0.0",
  "profile_id": "decision-check",
  "version": "1.0.0",
  "name": "decision-check",
  "enabled": true,
  "task_kind": "decision",
  "required_inputs": [
    "decision_version",
    "assumptions",
    "hard_constraints"
  ],
  "attention_tags": [
    "flip-condition",
    "minimum-verification"
  ],
  "output_fields": [
    "triggers",
    "verification_actions"
  ],
  "allowed_tool_categories": [
    "read_supplied"
  ],
  "voice": "persona",
  "recommendation_mode": "conditional_advice",
  "references": [],
  "source_trust": "built_in",
  "review_ref": "synthetic-protocol-tests"
}
